{
  "target_group": {
    "name": "リボンクロック",
    "short_name": "リボクロ",
    "official_x": "https://x.com/Ribbon_Clock",
    "official_tiktok": "https://www.tiktok.com/@ribbon_clock",
    "canonical_id": "group:ribbon-clock"
  },
  "featured_member": {
    "name": "神楽あゆ",
    "member_color": "red",
    "color_code": "#ef4444",
    "birthday_title": "神楽あゆ生誕祭 2026（20th Anniversary）",
    "crowdfunding_url": "https://x.com/Ribbon_Clock/status/2114643208710033610",
    "banner_image": "https://pbs.twimg.com/media/HVi3dC9bsAAinY6?format=jpg&name=large",
    "canonical_id": "member:ribbon-clock:ayu-kagura"
  },
  "promotions": [
    {
      "id": "promo-ayyu-birthday-cf",
      "type": "hero",
      "badge": "20TH BIRTHDAY",
      "title": "神楽あゆ 生誕祭クラウドファンディング",
      "subtitle": "初めての生誕祭、そして20歳という大切な節目🎀 クラファン開催中♡",
      "cta_label": "CAMPFIREで支援する ↗",
      "cta_url": "https://camp-fire.jp/projects/983246/view?utm_campaign=cp_po_share_c_msg_mypage_projects_show",
      "image_url": "https://pbs.twimg.com/media/HVi3dC9bsAAinY6?format=jpg&name=large",
      "deadline": "2026-11-22",
      "priority": 100,
      "active": true
    },
    {
      "id": "promo-ayyu-birthday-live",
      "type": "medium",
      "badge": "生誕祭2026",
      "title": "神楽あゆ生誕祭2026 開催カウントダウン",
      "subtitle": "2026年12月6日(日) 開催予定！20歳メモリアル生誕公演",
      "cta_label": "公式告知を見る ↗",
      "cta_url": "https://x.com/Ribbon_Clock/status/2114643208710033610",
      "deadline": "2026-12-06",
      "priority": 90,
      "active": false
    },
    {
      "id": "promo-tiktok-latest",
      "type": "inline",
      "badge": "TikTok",
      "title": "リボンクロック 公式TikTok",
      "subtitle": "最新動画をチェックしていいね・保存で応援🎀",
      "cta_label": "TikTokを開く ↗",
      "cta_url": "https://www.tiktok.com/@ribbon_clock",
      "priority": 50,
      "active": false
    }
  ],
  "current_next_id": "20261031-1",
  "sessions": [
    {
      "id": "20261031-1",
      "title": "はなまるっ Vol.158～全組25分ハロウィンSP～",
      "date": "2026-10-31",
      "day_of_week": "土",
      "session_name": "昼帯SP",
      "venue": {
        "canonical_id": "venue:shibuya-ring",
        "name": "渋谷RING",
        "map_query": "渋谷RING",
        "map_url": "https://maps.google.com/?q=渋谷RING"
      },
      "live": {
        "start_time": "12:50",
        "end_time": "13:15",
        "stage": "メインステージ"
      },
      "benefit": {
        "type": "並行",
        "start_time": "13:20",
        "end_time": "14:20",
        "booth": "並行C"
      },
      "photo": null,
      "special_notes": "🎃 ハロウィン特別衣装での出演！全組25分枠",
      "admission_bonus": "指名入場特典：お目当て3択（①10秒動画券 / ②写真+30秒トーク / ③券5枚集合写真）",
      "ticket": {
        "platform": "TicketDive",
        "url": "https://ticketdive.com/event/hanamaru_158",
        "prices": [
          {
            "tier": "前方エリア",
            "price": "¥4,500"
          },
          {
            "tier": "通常エリア",
            "price": "¥2,500"
          },
          {
            "tier": "当日券",
            "price": "各+¥500 (+1D)"
          }
        ]
      },
      "image_url": "https://pbs.twimg.com/media/HVIjWywaQAE3BM9?format=jpg&name=large",
      "source_tweet_url": "https://x.com/Ribbon_Clock/status/2112891667640656194",
      "images": [
        {
          "type": "flyer",
          "label": "フライヤー (1/2)",
          "url": "https://pbs.twimg.com/media/HVIjWywaQAE3BM9.jpg?name=large"
        },
        {
          "type": "timetable",
          "label": "タイムテーブル (2/2)",
          "url": "https://pbs.twimg.com/media/HVIjWzDbwAE3HCU.jpg?name=large"
        }
      ],
      "source_refs": [
        {
          "type": "x_post",
          "source_id": "2112891667640656194",
          "url": "https://x.com/Ribbon_Clock/status/2112891667640656194"
        }
      ]
    },
    {
      "id": "20261101-1",
      "title": "はなまるっ Vol.159～全組25分SP～",
      "date": "2026-11-01",
      "day_of_week": "日",
      "session_name": "1部（昼）",
      "venue": {
        "canonical_id": "venue:shinjuku-zirco-tokyo",
        "name": "新宿ZircoTokyo",
        "map_query": "Zirco Tokyo",
        "map_url": "https://maps.google.com/?q=新宿ZircoTokyo"
      },
      "live": {
        "start_time": "15:05",
        "end_time": "15:30",
        "stage": "Zirco Stage"
      },
      "benefit": {
        "type": "並行",
        "start_time": "15:35",
        "end_time": "16:35",
        "booth": "並行B"
      },
      "photo": null,
      "special_notes": "日曜昼・全組25分SP",
      "admission_bonus": "指名入場特典：お目当て3択（①10秒動画券 / ②写真+30秒トーク / ③券5枚集合写真）",
      "ticket": {
        "platform": "TicketDive",
        "url": "https://ticketdive.com/event/hanamaru_159",
        "prices": [
          {
            "tier": "前方エリア",
            "price": "¥4,500"
          },
          {
            "tier": "通常エリア",
            "price": "¥2,500"
          },
          {
            "tier": "当日券",
            "price": "各+¥500 (+1D)"
          }
        ]
      },
      "image_url": "https://pbs.twimg.com/media/HVYs_pwacAADw5Q?format=jpg&name=large",
      "source_tweet_url": "https://x.com/Ribbon_Clock/status/2114341213147205692",
      "images": [
        {
          "type": "flyer",
          "label": "フライヤー (1/2)",
          "url": "https://pbs.twimg.com/media/HVYs_pwacAADw5Q.jpg?name=large"
        },
        {
          "type": "timetable",
          "label": "タイムテーブル (2/2)",
          "url": "https://pbs.twimg.com/media/HVYs_ptbcAESY9P.jpg?name=large"
        }
      ],
      "source_refs": [
        {
          "type": "x_post",
          "source_id": "2114341213147205692",
          "url": "https://x.com/Ribbon_Clock/status/2114341213147205692"
        }
      ]
    },
    {
      "id": "20261101-2",
      "title": "IDOL Treasure bottle LIVE",
      "date": "2026-11-01",
      "day_of_week": "日",
      "session_name": "2部（夜）",
      "venue": {
        "canonical_id": "venue:batur-tokyo",
        "name": "BATUR TOKYO（バトゥール東京）",
        "map_query": "バトゥール東京",
        "map_url": "https://maps.google.com/?q=バトゥール東京"
      },
      "live": {
        "start_time": "18:35",
        "end_time": "18:55",
        "stage": "メインチャペル"
      },
      "benefit": {
        "type": "並行",
        "start_time": "19:05",
        "end_time": "20:05",
        "booth": "2階チャペルB"
      },
      "photo": null,
      "special_notes": "バトゥール東京・夜帯ライブ！前売券は当日会場精算",
      "admission_bonus": "指名入場特典：お目当て3択（①10秒動画券 / ②写真+30秒トーク / ③券5枚集合写真）",
      "ticket": {
        "platform": "TIGET",
        "url": "http://tiget.net/events/531498",
        "prices": [
          {
            "tier": "前売券",
            "price": "¥3,200 (+1D)"
          },
          {
            "tier": "当日券",
            "price": "¥3,700 (+1D)"
          }
        ]
      },
      "image_url": "https://pbs.twimg.com/media/HVeSDfQbEAAs_A5?format=jpg&name=large",
      "source_tweet_url": "https://x.com/Ribbon_Clock/status/2114597900827115847",
      "images": [
        {
          "type": "flyer",
          "label": "フライヤー (1/2)",
          "url": "https://pbs.twimg.com/media/HVeSDfQbEAAs_A5.jpg?name=large"
        },
        {
          "type": "timetable",
          "label": "タイムテーブル (2/2)",
          "url": "https://pbs.twimg.com/media/HVeSDfIbAAAOaN2.jpg?name=large"
        }
      ],
      "source_refs": [
        {
          "type": "x_post",
          "source_id": "2114597900827115847",
          "url": "https://x.com/Ribbon_Clock/status/2114597900827115847"
        }
      ]
    },
    {
      "id": "20261103-1",
      "title": "アイドルマリアージュVol.79",
      "date": "2026-11-03",
      "day_of_week": "火祝",
      "session_name": "祝日昼帯",
      "venue": {
        "canonical_id": "venue:bellesalle-toranomon",
        "name": "ベルサール虎ノ門",
        "map_query": "ベルサール虎ノ門",
        "map_url": "https://maps.google.com/?q=ベルサール虎ノ門"
      },
      "live": {
        "start_time": "11:55",
        "end_time": "12:15",
        "stage": "ホール"
      },
      "benefit": {
        "type": "並行",
        "start_time": "12:20",
        "end_time": "13:20",
        "booth": "並行C"
      },
      "photo": null,
      "special_notes": "文化の日祝日！マリアージュ出演",
      "admission_bonus": "指名入場特典：お目当て3択（①10秒動画券 / ②写真+30秒トーク / ③券5枚集合写真）",
      "ticket": {
        "platform": "TicketDive",
        "url": "https://ticketdive.com/event/idolmariage_79",
        "prices": [
          {
            "tier": "前方エリア",
            "price": "¥5,000"
          },
          {
            "tier": "通常エリア",
            "price": "¥3,000"
          },
          {
            "tier": "当日券",
            "price": "各+¥500 (+1D)"
          }
        ]
      },
      "image_url": "https://pbs.twimg.com/media/HVxASJ0a0AEORf5.jpg?name=large",
      "source_tweet_url": "https://x.com/Ribbon_Clock/status/2115639776422625284",
      "images": [
        {
          "type": "flyer",
          "label": "フライヤー (1/2)",
          "url": "https://pbs.twimg.com/media/HVxASJ0a0AEORf5.jpg?name=large"
        },
        {
          "type": "timetable",
          "label": "タイムテーブル (2/2)",
          "url": "https://pbs.twimg.com/media/HVxASJ9aQAAb4i-.jpg?name=large"
        }
      ],
      "source_refs": [
        {
          "type": "x_post",
          "source_id": "2115639776422625284",
          "url": "https://x.com/Ribbon_Clock/status/2115639776422625284"
        }
      ]
    },
    {
      "id": "20261105-1",
      "title": "POLAROID - FREE -",
      "date": "2026-11-05",
      "day_of_week": "木",
      "session_name": "夕方無銭",
      "venue": {
        "canonical_id": "venue:harajuku-ruido",
        "name": "原宿RUIDO",
        "map_query": "原宿RUIDO",
        "map_url": "https://maps.google.com/?q=原宿RUIDO"
      },
      "live": {
        "start_time": "--:--",
        "end_time": "--:--",
        "stage": "タイテ告知待ち"
      },
      "benefit": {
        "type": "未定",
        "start_time": "--:--",
        "end_time": "--:--",
        "booth": "告知待ち"
      },
      "photo": null,
      "special_notes": "木曜無銭ライブ！※タイムテーブルは公式告知待ち",